{
  "$schema": "https://json-schema.org/draft/2020-12/schema",
  "$id": "https://attestscope.ai/schema/attestscope-0.1.1.schema.json",
  "title": "AttestScope record file, version 0.1.1",
  "description": "One record per file. The fingerprints are recomputed by every verifier from the content and the signatures checked with the issuer's published keys; nothing is trusted as written. Version 0.1 files (format assay-record) validate against assay-record-0.1.schema.json. See https://attestscope.ai/spec.html",
  "type": "object",
  "required": ["format", "version", "record_id", "issuer", "origin", "issued_at", "assessment", "content", "proof"],
  "properties": {
    "format": { "const": "attestscope" },
    "version": { "const": "0.1.1" },
    "record_id": { "type": "string", "pattern": "^[A-Z]{2,6}-\\d{6}-\\d{6}-[0-9A-HJKMNP-TV-Z]{4}-[0-9A-HJKMNP-TV-Z]{4}-[0-9A-HJKMNP-TV-Z]{4}$" },
    "issuer": { "type": "string", "pattern": "^[A-Z]{2,6}$" },
    "origin": { "enum": ["generated", "registered"] },
    "issued_at": { "$ref": "#/$defs/utc" },
    "assessment": {
      "type": "object",
      "properties": {
        "protocol": { "type": "string" },
        "model": { "type": "string" },
        "assistant": { "type": "string" },
        "language": { "type": "string" }
      },
      "additionalProperties": false
    },
    "content": {
      "type": "object",
      "required": ["project", "context", "report"],
      "properties": {
        "project": { "type": "string" },
        "context": { "type": "string" },
        "report": { "type": "string" }
      },
      "additionalProperties": false
    },
    "proof": {
      "type": "object",
      "required": ["fingerprint", "seal", "signature"],
      "properties": {
        "fingerprint": { "$ref": "#/$defs/fingerprint" },
        "seal": {
          "type": "object",
          "required": ["value"],
          "properties": {
            "value": { "$ref": "#/$defs/seal" },
            "verify": { "type": "string", "format": "uri" }
          },
          "additionalProperties": false
        },
        "signature": { "$ref": "#/$defs/signature" },
        "timestamps": { "$ref": "#/$defs/timestamps" }
      },
      "additionalProperties": false
    },
    "follow_up": { "$ref": "#/$defs/followUpV2" },
    "notice": { "type": "string" }
  },
  "allOf": [
    {
      "if": { "properties": { "origin": { "const": "generated" } } },
      "then": {
        "properties": {
          "assessment": { "required": ["protocol", "model"] },
          "proof": { "properties": { "fingerprint": { "properties": { "profile": { "const": "riftveil-report-v1" } } } } }
        }
      }
    },
    {
      "if": { "properties": { "origin": { "const": "registered" } } },
      "then": {
        "properties": {
          "assessment": { "required": ["assistant"] },
          "proof": { "properties": { "fingerprint": { "properties": { "profile": { "const": "riftveil-content-v1" } } } } }
        }
      }
    }
  ],
  "$defs": {
    "utc": { "type": "string", "pattern": "^\\d{4}-\\d{2}-\\d{2}T\\d{2}:\\d{2}:\\d{2}Z$" },
    "utcOrEmpty": { "type": "string", "pattern": "^(|\\d{4}-\\d{2}-\\d{2}T\\d{2}:\\d{2}:\\d{2}Z)$" },
    "hex64": { "type": "string", "pattern": "^[0-9a-f]{64}$" },
    "fingerprint": {
      "type": "object",
      "required": ["alg", "profile", "value"],
      "properties": {
        "alg": { "const": "sha-256" },
        "profile": { "type": "string" },
        "value": { "type": "string", "pattern": "^([0-9a-f]{64})?$" }
      },
      "additionalProperties": false
    },
    "seal": { "type": "string", "pattern": "^S\\d{1,2}-([0-9A-HJKMNP-TV-Z]{4}-){7}[0-9A-HJKMNP-TV-Z]{4}$" },
    "sealOrEmpty": { "type": "string", "pattern": "^(|S\\d{1,2}-([0-9A-HJKMNP-TV-Z]{4}-){7}[0-9A-HJKMNP-TV-Z]{4})$" },
    "signature": {
      "type": "object",
      "description": "Issuer's Ed25519 signature (RFC 8032) over the same message as the seal, base64url without padding.",
      "required": ["alg", "key", "value", "keys"],
      "properties": {
        "alg": { "const": "ed25519" },
        "key": { "type": "string", "pattern": "^ed25519-\\d{1,3}$" },
        "value": { "type": "string", "pattern": "^[A-Za-z0-9_-]{86}$" },
        "keys": { "type": "string", "format": "uri" }
      },
      "additionalProperties": false
    },
    "timestamps": {
      "type": "array",
      "description": "Optional time stamps over the SHA-256 of the seal message.",
      "items": {
        "type": "object",
        "required": ["type", "imprint", "token"],
        "properties": {
          "type": { "const": "rfc3161" },
          "tsa": { "type": "string" },
          "imprint": { "$ref": "#/$defs/hex64" },
          "token": { "type": "string", "pattern": "^[A-Za-z0-9+/]+={0,2}$" }
        },
        "additionalProperties": false
      }
    },
    "followUpCommon": {
      "type": "object",
      "required": ["profile", "verified_by", "checked", "questions", "decision", "conditions", "place", "signature", "proof"],
      "properties": {
        "verified_by": {
          "type": "object",
          "required": ["last_name", "first_name", "role"],
          "properties": {
            "last_name": { "type": "string" },
            "first_name": { "type": "string" },
            "role": { "type": "string" }
          },
          "additionalProperties": false
        },
        "checked": { "type": "string" },
        "questions": {
          "type": "array",
          "items": {
            "type": "object",
            "required": ["n", "question", "suggested_owner", "assigned_to"],
            "properties": {
              "n": { "type": "integer", "minimum": 1 },
              "question": { "type": "string" },
              "suggested_owner": { "type": "string" },
              "assigned_to": { "type": "string" }
            },
            "additionalProperties": false
          }
        },
        "decision": { "enum": ["", "proceed", "conditions", "stop"] },
        "conditions": { "type": "string" },
        "place": { "type": "string" },
        "signature": {
          "type": "object",
          "description": "Simple electronic signature of the person who decides, made on screen. Not the issuer's signature.",
          "required": ["method", "typed", "image"],
          "properties": {
            "method": { "enum": ["", "drawn", "typed"] },
            "typed": { "type": "string" },
            "image": { "type": "string", "pattern": "^(|data:image/png;base64,[A-Za-z0-9+/=]+)$" }
          },
          "additionalProperties": false
        },
        "decided_at": { "$ref": "#/$defs/utc", "description": "Informative, set by the signer's device; the proven time is proof.seal.sealed_at." }
      }
    },
    "followUpProof": {
      "type": "object",
      "required": ["fingerprint", "seal"],
      "properties": {
        "fingerprint": { "$ref": "#/$defs/fingerprint" },
        "seal": {
          "type": "object",
          "properties": {
            "value": { "$ref": "#/$defs/sealOrEmpty" },
            "sealed_at": { "$ref": "#/$defs/utcOrEmpty" },
            "verify": { "type": "string", "format": "uri" }
          },
          "additionalProperties": false
        },
        "signature": { "$ref": "#/$defs/signature" },
        "timestamps": { "$ref": "#/$defs/timestamps" }
      },
      "additionalProperties": false
    },
    "followUpV1": {
      "allOf": [{ "$ref": "#/$defs/followUpCommon" }],
      "properties": {
        "profile": { "const": "riftveil-decision-v1" },
        "verified_by": true, "checked": true, "questions": true, "decision": true, "conditions": true, "place": true, "signature": true, "decided_at": true,
        "proof": { "$ref": "#/$defs/followUpProof" }
      },
      "additionalProperties": false
    },
    "followUpV2": {
      "allOf": [
        { "$ref": "#/$defs/followUpCommon" },
        {
          "if": { "properties": { "proof": { "properties": { "seal": { "properties": { "value": { "minLength": 1 } }, "required": ["value"] } } } } },
          "then": { "properties": { "proof": { "required": ["signature"] } } }
        }
      ],
      "properties": {
        "profile": { "const": "riftveil-decision-v2" },
        "verified_by": true, "checked": true, "questions": true, "decision": true, "conditions": true, "place": true, "signature": true, "decided_at": true,
        "final_document": {
          "type": "object",
          "description": "Fingerprint of the document that actually goes out, computed on the signer's device; the document is never sent.",
          "required": ["name", "size", "sha256"],
          "properties": {
            "name": { "type": "string" },
            "size": { "type": "integer", "minimum": 0 },
            "sha256": { "$ref": "#/$defs/hex64" }
          },
          "additionalProperties": false
        },
        "previous": {
          "description": "The sealed follow-up this one completes, in full, with its proof.",
          "oneOf": [{ "$ref": "#/$defs/followUpV2" }, { "$ref": "#/$defs/followUpV1" }]
        },
        "proof": { "$ref": "#/$defs/followUpProof" }
      },
      "additionalProperties": false
    }
  }
}
